{
	"basics": {
		"name": "Richard Hendriks",
		"label": "Programmer",
		"image": "",
		"email": "richard.hendriks@mail.com",
		"phone": "(912) 555-4321",
		"summary": "Richard hails from Tulsa. He has earned degrees from the University of Oklahoma and Stanford. (Go Sooners and Cardinal!) Before starting Pied Piper, he worked for Hooli as a part time software developer. While his work focuses on applied information theory, mostly optimizing lossless compression schema of both the length-limited and adaptive variants, his non-work interests range widely, everything from quantum computing to chaos theory. He could tell you about it, but THAT would NOT be a “length-limited” conversation!",
		"location": {
			"address": "2712 Broadway St",
			"postalCode": "CA 94115",
			"city": "San Francisco",
			"countryCode": "US",
			"region": "California"
		},
		"links": [
			{
				"url": "https://www.twitter.com/neutralthoughts",
				"label": "@neutralthoughts"
			},
			{
				"url": "https://soundcloud.example.com/dandymusicnl",
				"label": "@dandymusicnl"
			}
		]
	},
	"work": [
		{
			"employer": "Pied Piper",
			"location": "Palo Alto, CA",
			"description": "Awesome compression company",
			"position": "CEO/President",
			"url": "http://piedpiper.example.com",
			"startDate": "2013-12-01",
			"endDate": "2014-12-01",
			"summary": "Pied Piper is a multi-platform technology based on a proprietary universal compression algorithm that has consistently fielded high Weisman Scores™ that are not merely competitive, but approach the theoretical limit of lossless compression.",
			"highlights": [
				"Build an algorithm for artist to detect if their music was violating copy right infringement laws",
				"Successfully won Techcrunch Disrupt",
				"Optimized an algorithm that holds the current world record for Weisman Scores"
			]
		}
	],
	"volunteer": [
		{
			"organization": "CoderDojo",
			"position": "Teacher",
			"url": "http://coderdojo.example.com/",
			"startDate": "2012-01-01",
			"endDate": "2013-01-01",
			"summary": "Global movement of free coding clubs for young people.",
			"highlights": [
				"Awarded 'Teacher of the Month'"
			]
		}
	],
	"education": [
		{
			"institution": "University of Oklahoma",
			"url": "https://www.ou.edu/",
			"area": "Information Technology",
			"startDate": "2011-06-01",
			"endDate": "2014-01-01",
			"programs": [
				{
					"type": "Degree",
					"designation": "Bachelor of Science/B.S.",
					"name": "Information Technology",
					"gpa": "4.0"
				}
			],
			"courses": [
				"DB1101 - Basic SQL",
				"CS2011 - Java Introduction"
			]
		}
	],
	"awards": [
		{
			"title": "Digital Compression Pioneer Award",
			"date": "2014-11-01",
			"awarder": "Techcrunch",
			"summary": "There is no spoon."
		}
	],
	"publications": [
		{
			"name": "Video compression for 3d media",
			"publisher": "Hooli",
			"releaseDate": "2014-10-01",
			"url": "http://en.wikipedia.org/wiki/Silicon_Valley_(TV_series)",
			"summary": "Innovative middle-out compression algorithm that changes the way we store data."
		}
	],
	"skills": [
		{
			"name": "Web Development",
			"level": "Advanced",
			"keywords": [
				"HTML",
				"CSS",
				"Javascript"
			]
		},
		{
			"name": "Compression",
			"level": "Intermediate",
			"keywords": [
				"Mpeg",
				"MP4",
				"GIF"
			]
		}
	],
	"languages": [
		{
			"language": "English",
			"fluency": "Native"
		}
	],
	"interests": [
		{
			"name": "Wildlife",
			"keywords": [
				"Ferrets",
				"Unicorns"
			]
		}
	],
	"references": [
		{
			"name": "Erlich Bachman",
			"reference": "It is my pleasure to recommend Richard, his performance working as a consultant for Main St. Company proved that he will be a valuable addition to any company."
		}
	],
	"projects": [
		{
			"name": "Miss Direction",
			"description": "A mapping engine that misguides you",
			"highlights": [
				"Won award at AIHacks 2016",
				"Built by all women team of newbie programmers",
				"Using modern technologies such as GoogleMaps, Chrome Extension and Javascript"
			],
			"keywords": [
				"GoogleMaps",
				"Chrome Extension",
				"Javascript"
			],
			"startDate": "2016-08-24",
			"endDate": "2016-08-24",
			"url": "http://missdirection.example.com",
			"roles": [
				"Team lead",
				"Designer"
			],
			"entity": "Smoogle",
			"type": "application"
		}
	],
	"meta": {
		"canonical": "https://raw.githubusercontent.com/jsonresume/resume-schema/v1.0.0/sample.resume.json",
		"version": "1.0.0",
		"lastModified": "2026-02-27T00:00:00.000Z"
	}
}